{
  "schema_version": 1,
  "case_id": "joss-peat-2025",
  "annotation_version": "draft-v1",
  "text_gold_mode": "mixed",
  "review": {
    "annotator": "codex-assisted-visual-annotation",
    "reviewer": null,
    "reviewed_at": null,
    "status": "draft"
  },
  "pages": [
    {
      "page_number": 1,
      "expected_route": "structure-model",
      "nodes": [
        {
          "gold_id": "p1-logo",
          "type": "image",
          "role": "decorative",
          "indexable": false,
          "text": "",
          "order_index": 0,
          "bounding_box": [18.0, 11.9, 174.0, 71.7]
        },
        {
          "gold_id": "p1-title",
          "type": "heading",
          "role": "content",
          "indexable": true,
          "text": "PDF Entity Annotation Tool (PEAT)",
          "order_index": 1,
          "bounding_box": [166.9, 131.2, 435.0, 156.3]
        },
        {
          "gold_id": "p1-authors",
          "type": "paragraph",
          "role": "metadata",
          "indexable": true,
          "text": "Christopher G. Stahl, Kristan J. Markey, Brian C. Jewell, Dahnish Shams, Michele M. Taylor, A. Amina Wilkins, Sean Watford, Andy Shapiro, and Michelle Angrish",
          "order_index": 2,
          "bounding_box": [166.9, 172.8, 526.5, 217.8]
        },
        {
          "gold_id": "p1-affiliations",
          "type": "paragraph",
          "role": "metadata",
          "indexable": true,
          "text": "Oak Ridge National Laboratory, USA; Office of Research and Development, United States Environmental Protection Agency.",
          "order_index": 3,
          "bounding_box": [166.9, 224.9, 518.3, 249.0]
        },
        {
          "gold_id": "p1-sidebar-metadata",
          "type": "list",
          "role": "metadata",
          "indexable": true,
          "text": "DOI: 10.21105/joss.05336. Software links: Review, Repository, Archive. Editor: Ana Trisovic. Reviewers: @flor14 and @RuneBlaze. Submitted: 24 January 2023. Published: 08 April 2025. License: CC BY 4.0.",
          "order_index": 4,
          "bounding_box": [28.1, 249.3, 157.7, 490.9]
        },
        {
          "gold_id": "p1-disclaimer",
          "type": "paragraph",
          "role": "metadata",
          "indexable": false,
          "text": "The views expressed in this manuscript are those of the authors and do not necessarily reflect the views or policies of the U.S. EPA, UT-Battelle, LLC, or U.S. Department of Energy.",
          "order_index": 5,
          "bounding_box": [166.9, 264.8, 552.8, 302.5]
        },
        {
          "gold_id": "p1-summary-heading",
          "type": "heading",
          "role": "content",
          "indexable": true,
          "text": "Summary",
          "order_index": 6,
          "bounding_box": [166.9, 316.9, 223.2, 336.8]
        },
        {
          "gold_id": "p1-summary-problem",
          "type": "paragraph",
          "role": "content",
          "indexable": true,
          "text": "Existing workflows for creating labeled scientific text datasets are labor intensive. Converting PDF to plain text can lose document structure and provenance, and extraction can fail because of sequential blocks, multiple columns, font encodings, plots, and tables. PEAT was developed so users can annotate publications in their current print format and capture annotations in a machine-readable format.",
          "order_index": 7,
          "bounding_box": [166.4, 344.9, 554.7, 658.3]
        },
        {
          "gold_id": "p1-summary-solution",
          "type": "paragraph",
          "role": "content",
          "indexable": true,
          "text": "PEAT allows annotations to be completed on the original PDF document structure without first converting it to plain text. Users can create schemas for domain-specific annotation tags, supporting easier and more accurate machine-readable annotation.",
          "order_index": 8,
          "bounding_box": [166.4, 661.7, 553.0, 736.0]
        },
        {
          "gold_id": "p1-footer",
          "type": "caption",
          "role": "boilerplate",
          "indexable": false,
          "text": "Stahl et al. (2025). PDF Entity Annotation Tool (PEAT). Journal of Open Source Software, 10(108), 5336. Page 1.",
          "order_index": 9,
          "bounding_box": [39.3, 775.2, 552.8, 789.8]
        }
      ],
      "relations": []
    },
    {
      "page_number": 2,
      "expected_route": "native",
      "nodes": [
        {
          "gold_id": "p2-logo",
          "type": "image",
          "role": "decorative",
          "indexable": false,
          "text": "",
          "order_index": 0,
          "bounding_box": [18.0, 11.9, 174.0, 71.7]
        },
        {
          "gold_id": "p2-statement-heading",
          "type": "heading",
          "role": "content",
          "indexable": true,
          "text": "Statement of need",
          "order_index": 1,
          "bounding_box": [166.9, 96.0, 279.9, 115.9]
        },
        {
          "gold_id": "p2-need",
          "type": "paragraph",
          "role": "content",
          "indexable": true,
          "text": "The volume of publications makes manual extraction unsustainable, while machine-learning development requires labeled datasets. PDFs preserve visual structure but do not readily support extraction into other formats; coordinates and formatting can be lost during PDF-to-text conversion.",
          "order_index": 2,
          "bounding_box": [166.5, 123.5, 554.7, 329.4]
        },
        {
          "gold_id": "p2-existing-tools",
          "type": "paragraph",
          "role": "content",
          "indexable": true,
          "text": "BRAT, TeamTat, GATE, and Dextr first convert PDF to plain text, which can lose double or triple columns, tables, words, lines, and layout. PDFAnno allowed annotation layers over PDFs but is no longer maintained; React-PDF Annot provides basic PDFJS annotations and served as a baseline for PEAT.",
          "order_index": 3,
          "bounding_box": [166.5, 332.8, 554.1, 478.8]
        },
        {
          "gold_id": "p2-peat-design",
          "type": "paragraph",
          "role": "content",
          "indexable": true,
          "text": "PEAT lets users annotate and label data directly in PDF format while retaining the intended document structure. It is a portable standalone Electron application for Windows, Linux, and Macintosh.",
          "order_index": 4,
          "bounding_box": [166.5, 482.2, 554.7, 580.5]
        },
        {
          "gold_id": "p2-footer",
          "type": "caption",
          "role": "boilerplate",
          "indexable": false,
          "text": "Stahl et al. (2025). PDF Entity Annotation Tool (PEAT). Journal of Open Source Software, 10(108), 5336. Page 2.",
          "order_index": 5,
          "bounding_box": [39.3, 775.2, 552.8, 789.8]
        }
      ],
      "relations": []
    },
    {
      "page_number": 3,
      "expected_route": "structure-model",
      "nodes": [
        {
          "gold_id": "p3-logo",
          "type": "image",
          "role": "decorative",
          "indexable": false,
          "text": "",
          "order_index": 0,
          "bounding_box": [18.0, 11.9, 174.0, 71.7]
        },
        {
          "gold_id": "p3-interface-image",
          "type": "image",
          "role": "content",
          "indexable": true,
          "text": "Screenshot of the PEAT user interface showing a schema/entity selector, annotation table, search controls, and a PDF page.",
          "order_index": 1,
          "bounding_box": [166.9, 99.2, 552.8, 314.3]
        },
        {
          "gold_id": "p3-interface-caption",
          "type": "caption",
          "role": "content",
          "indexable": true,
          "text": "Figure 1: PEAT User Interface.",
          "order_index": 2,
          "bounding_box": [300.5, 321.6, 419.1, 334.7]
        },
        {
          "gold_id": "p3-features",
          "type": "paragraph",
          "role": "content",
          "indexable": true,
          "text": "PEAT embeds its dependencies and has a 500 MB footprint. It loads local PDFs, supports standard and customizable annotation types, labels, entities, colors, schema import and export, PDF X/Y coordinates, search, annotation manipulation, and save/load progress. Completed annotations, full text, and metadata can be exported as JSON for NLP applications such as spaCy or PyTorch.",
          "order_index": 3,
          "bounding_box": [166.5, 353.6, 554.1, 475.8]
        },
        {
          "gold_id": "p3-conclusion-heading",
          "type": "heading",
          "role": "content",
          "indexable": true,
          "text": "Conclusion and Future Work",
          "order_index": 4,
          "bounding_box": [166.9, 489.9, 340.5, 509.8]
        },
        {
          "gold_id": "p3-conclusion",
          "type": "paragraph",
          "role": "content",
          "indexable": true,
          "text": "PEAT produces machine-readable annotated datasets from native PDFs and supports standard or custom named-entity annotations. Proposed future features include collaborative annotation, hierarchical relationships, ontology-based automatic annotation, and a pluggable architecture for generating and aligning text layers or segments.",
          "order_index": 5,
          "bounding_box": [166.9, 517.4, 554.7, 663.5]
        },
        {
          "gold_id": "p3-ack-heading",
          "type": "heading",
          "role": "metadata",
          "indexable": false,
          "text": "Acknowledgements",
          "order_index": 6,
          "bounding_box": [166.9, 677.6, 281.3, 697.5]
        },
        {
          "gold_id": "p3-ack-part1",
          "type": "paragraph",
          "role": "metadata",
          "indexable": false,
          "text": "The manuscript was authored by UT-Battelle under a U.S. Department of Energy contract and sponsored by the U.S. Environmental Protection Agency.",